{
  "schema": "die.h01.brave-udd-runtime-receipt.v1",
  "status": "PASS",
  "job_id": "H01-107C-QWEN-P001-RECHECK-003",
  "provider_id": "qwen",
  "profile_id": "h01-web-p001",
  "udd_id": "h01-web-s01",
  "started_at": "2026-09-12T17:50:24.180Z",
  "completed_at": "2026-09-12T17:51:14.998Z",
  "mode": "wait-result",
  "ownership": {
    "launcher_udd_mutex": true,
    "max_active_per_udd": 1,
    "lock_path": "/run/user/1000/die-h01-brave/h01-web-s01.lock",
    "lock_released": true
  },
  "browser": {
    "launcher": "/opt/die/h01/bin/h01-brave-profile",
    "cdp_host": "127.0.0.1",
    "cdp_port": 9201,
    "loopback_only": true,
    "provider_origin": "https://chat.qwen.ai",
    "page_count_after_enforcement": 1,
    "browser_close_sent": true,
    "process_exited": true,
    "cdp_closed": true
  },
  "durable_result": {
    "path": "/home/kopiko/die-sessions/H01-107/company/company-os/die-h01/evidence/h01-107/qwen-p001-recheck-003/browser-job-result.json",
    "sha256": "d7c789b9159eef606af2abf112dcc5b82146ed810de6983d85af646552ff5f31",
    "terminal_state": "SUCCEEDED",
    "present": true
  },
  "error": null,
  "safety": {
    "cookies_read": false,
    "tokens_read": false,
    "session_bytes_read": false,
    "browser_profile_copied": false,
    "mission_control_mutated": false,
    "scheduler_owned": false
  }
}
